{
  "schema_version": "0.1.0",
  "benchmark_run_id": "benchmark_run_example_0001",
  "agent_variant_id": "STRUCTURED_FIRST",
  "agent_variant_revision": "05ea26a5c50c0404c18db3991397f407cbe16f7b",
  "model_config_sha256": "215296e0048cff5580f1785f62ae6e39aebca852875cdbbeed8935edccd1830e",
  "dataset_item_id": "q_example_0001",
  "release_id": "seed-release-v0.20",
  "release_manifest_sha256": "523500e04dd02b8a017d45398497c5e68323cdbcb830b930b53a9383254fa702",
  "execution_mode": "STRUCTURED",
  "structured_query_count": 3,
  "document_retrieval_count": 0,
  "model_call_attempt_count": 1,
  "model_call_success_count": 1,
  "model_call_failure_count": 0,
  "model_fallback_used": false,
  "model_failure_code": null,
  "citation_binding_status": "PASS",
  "unsupported_claim_count": 0,
  "evidence_validation_success_rate": 1,
  "scoring_eligible": true,
  "latency_ms": 12.5,
  "answer_sha256": "af7355ca7c922e1ab0b67d484f409738911537bc4d7b0f9722bb2d33a4306a31",
  "execution_trace_sha256": "5cc0da1f92ca8ebebd86348e5484287efcbbae6a22793baf1b50ebea353dcf36",
  "run_status": "OK"
}
